,Title,Year,Rated,Released,Runtime,Genre,Director,Writer,Actors,Plot,Language,Country,Awards,Poster,Ratings,Metascore,imdbRating,imdbVotes,imdbID,Type,DVD,BoxOffice,Production,Website,Response
0,Arsenal,2017,R,06 Jan 2017,97 min,"Action, Crime, Drama, Thriller",Steven C. Miller,Jason Mosberg,"Nicolas Cage, John Cusack, Adrian Grenier, Johnathon Schaech",A Southern mobster attempts to rescue his kidnapped brother.,English,"USA, Canada",N/A,https://m.media-amazon.com/images/M/MV5BMTEyMzk3ODYzMzdeQTJeQWpwZ15BbWU4MDk0MDc3ODAy._V1_SX300.jpg,"[{'Source': 'Internet Movie Database', 'Value': '4.0/10'}, {'Source': 'Rotten Tomatoes', 'Value': '3%'}, {'Source': 'Metacritic', 'Value': '25/100'}]",25,4.0,"3,246",tt5580536,movie,28 Mar 2017,N/A,Emmett/Furla/Oasis Films,N/A,True
1,Between Us,2012,R,05 Oct 2012,90 min,Drama,Dan Mirvish,"Joe Hortua (screenplay), Dan Mirvish (screenplay), Joe Hortua (play)","Julia Stiles, Melissa George, Taye Diggs, David Harbour","Two couples reunite over two incendiary evenings where anything can happen in this darkly comedic story of best friends, marriage, love, disappointment and dreams.",English,USA,2 wins & 1 nomination.,https://m.media-amazon.com/images/M/MV5BMTc5NzcyMzgyN15BMl5BanBnXkFtZTcwNDk1MzE2OQ@@._V1_SX300.jpg,"[{'Source': 'Internet Movie Database', 'Value': '4.6/10'}, {'Source': 'Rotten Tomatoes', 'Value': '38%'}]",N/A,4.6,930,tt1109574,movie,30 Jul 2013,N/A,Monterey Media,http://betweenusmovie.com/,True
2,Railroad Tigers,2016,Not Rated,23 Dec 2016,124 min,"Action, Comedy, War",Sheng Ding,"Sheng Ding, Alex Jia (script advisor), He Keke","Jackie Chan, Zitao Huang, Jaycee Chan, Kai Wang",A railroad worker in China in 1941 leads a team of freedom fighters against the Japanese in order to get food for the poor.,"Mandarin, Japanese, English",China,2 nominations.,https://m.media-amazon.com/images/M/MV5BMjdjYWJlNDUtMjU2YS00NDBjLTkzMjEtYWM1ZmE1MjNlOWIyXkEyXkFqcGdeQXVyNzI1NzMxNzM@._V1_SX300.jpg,"[{'Source': 'Internet Movie Database', 'Value': '5.9/10'}, {'Source': 'Metacritic', 'Value': '47/100'}]",47,5.9,"3,073",tt4687848,movie,N/A,N/A,N/A,N/A,True
3,Underworld: Blood Wars,2016,R,06 Jan 2017,91 min,"Action, Adventure, Fantasy, Horror",Anna Foerster,"Cory Goodman (screenplay by), Kyle Ward (story by), Cory Goodman (story by), Kevin Grevioux (based on characters created by), Len Wiseman (based on characters created by), Danny McBride (based on characters created by)","Kate Beckinsale, Theo James, Tobias Menzies, Lara Pulver","Vampire death dealer, Selene (Kate Beckinsale) fights to end the eternal war between the Lycan clan and the Vampire faction that betrayed her.","English, Saami",USA,N/A,https://m.media-amazon.com/images/M/MV5BMjI5Njk0NTIyNV5BMl5BanBnXkFtZTgwNjU4MjY5MDI@._V1_SX300.jpg,"[{'Source': 'Internet Movie Database', 'Value': '5.8/10'}, {'Source': 'Rotten Tomatoes', 'Value': '20%'}, {'Source': 'Metacritic', 'Value': '23/100'}]",23,5.8,"61,251",tt3717252,movie,25 Apr 2017,"$30,348,260",Lakeshore Entertainment,http://www.underworldbloodwars-movie.com/site/,True
4,100 Streets,2016,N/A,13 Jan 2017,93 min,Drama,Jim O'Hanlon,Leon Butler,"Idris Elba, Gemma Arterton, Kierston Wareing, Tom Cullen","Three people, three extraordinary stories. All lived out within a hundred London streets.",English,UK,N/A,https://m.media-amazon.com/images/M/MV5BMTc5NjQ3NzkzM15BMl5BanBnXkFtZTgwMDU2MTQ2MDI@._V1_SX300.jpg,"[{'Source': 'Internet Movie Database', 'Value': '5.7/10'}, {'Source': 'Rotten Tomatoes', 'Value': '41%'}, {'Source': 'Metacritic', 'Value': '44/100'}]",44,5.7,"3,191",tt2990126,movie,07 Mar 2017,N/A,Green Door Pictures,N/A,True
5,Alone in Berlin,2016,R,13 Jan 2017,103 min,Drama,Vincent Perez,"Achim von Borries (screenplay), Vincent Perez (screenplay), Bettine von Borries (collaboration on screenplay), Hans Fallada (novel)","Mikael Persbrandt, Emma Thompson, Daniel Brühl, Brendan Gleeson","After a Nazi German working class couple loses their son in World War II, they decide to retaliate by secretly leafletting handwritten cards in Berlin denouncing their government.",English,"UK, France, Germany",2 nominations.,https://m.media-amazon.com/images/M/MV5BMjEyZmQxOGYtYTk3MS00Njg3LWEwOWItYjFhYzVkNDhkMzYxXkEyXkFqcGdeQXVyMzA3Njg4MzY@._V1_SX300.jpg,"[{'Source': 'Internet Movie Database', 'Value': '6.4/10'}, {'Source': 'Rotten Tomatoes', 'Value': '59%'}, {'Source': 'Metacritic', 'Value': '52/100'}]",52,6.4,"5,970",tt3026488,movie,13 Jun 2017,"$19,428",X-Filme Creative Pool,N/A,True
6,The Book of Love,2016,PG-13,14 Apr 2016,106 min,Drama,Bill Purple,"Robbie Pickering, Bill Purple, Robbie Pickering (story by)","Jason Sudeikis, Maisie Williams, Jessica Biel, Mary Steenburgen","Henry is an introverted architect. After the death of his wife in a car accident, he sets out to help Millie, a homeless teen-ager, to build a raft to sail across the Atlantic.",English,USA,N/A,https://m.media-amazon.com/images/M/MV5BNzA2NzEwOTczMV5BMl5BanBnXkFtZTgwNDI3MzE2MDI@._V1_SX300.jpg,"[{'Source': 'Internet Movie Database', 'Value': '6.0/10'}, {'Source': 'Rotten Tomatoes', 'Value': '8%'}, {'Source': 'Metacritic', 'Value': '27/100'}]",27,6.0,"3,068",tt1330018,movie,04 Apr 2017,N/A,Electric Entertainment,N/A,True
7,The Bye Bye Man,2017,PG-13,13 Jan 2017,96 min,"Drama, Fantasy, Horror, Mystery, Thriller",Stacy Title,"Jonathan Penner (screenplay by), Robert Damon Schneck (based on ""The Bridge to Body Island"" by)","Douglas Smith, Lucien Laviscount, Cressida Bonas, Doug Jones",Three friends stumble upon the horrific origins of a mysterious figure they discover is the root cause of the evil behind unspeakable acts.,English,"USA, China",N/A,https://m.media-amazon.com/images/M/MV5BMTcxOTE5NzQwNF5BMl5BanBnXkFtZTgwOTMzMTc1ODE@._V1_SX300.jpg,"[{'Source': 'Internet Movie Database', 'Value': '4.3/10'}, {'Source': 'Rotten Tomatoes', 'Value': '20%'}, {'Source': 'Metacritic', 'Value': '37/100'}]",37,4.3,"16,533",tt4030600,movie,25 Apr 2017,"$22,377,458",STX Entertainment,N/A,True
8,Monster Trucks,2016,PG,13 Jan 2017,104 min,"Action, Adventure, Comedy, Family, Fantasy, Sci-Fi",Chris Wedge,"Derek Connolly (screenplay by), Matthew Robinson (story by), Jonathan Aibel (story by), Glenn Berger (story by)","Lucas Till, Jane Levy, Thomas Lennon, Barry Pepper",A young man working at a small town junkyard discovers and befriends a creature which feeds on oil being sought by a fracking company.,English,"USA, Canada",2 nominations.,https://m.media-amazon.com/images/M/MV5BMTEyMjAzMDk4ODZeQTJeQWpwZ15BbWU4MDUxNzMzMDEy._V1_SX300.jpg,"[{'Source': 'Internet Movie Database', 'Value': '5.7/10'}, {'Source': 'Rotten Tomatoes', 'Value': '32%'}, {'Source': 'Metacritic', 'Value': '41/100'}]",41,5.7,"13,139",tt3095734,movie,11 Apr 2017,"$33,243,820",Paramount Pictures,http://MonsterTrucksMovie.com,True
9,Sleepless,2017,R,13 Jan 2017,95 min,"Action, Crime, Thriller",Baran bo Odar,"Andrea Berloff (screenplay by), Frédéric Jardin (based on the film ""Nuit blanche"" written by), Nicolas Saada (based on the film ""Nuit blanche"" written by), Olivier Douyère (based on the film ""Nuit blanche"" written by)","Jamie Foxx, Michelle Monaghan, Scoot McNairy, Dermot Mulroney",A cop with a connection to the criminal underworld scours a nightclub in search of his kidnapped son.,English,USA,1 nomination.,https://m.media-amazon.com/images/M/MV5BNjEwMDAyOTM4OV5BMl5BanBnXkFtZTgwMzc4MjMyMDI@._V1_SX300.jpg,"[{'Source': 'Internet Movie Database', 'Value': '5.6/10'}, {'Source': 'Rotten Tomatoes', 'Value': '24%'}, {'Source': 'Metacritic', 'Value': '34/100'}]",34,5.6,"24,571",tt2072233,movie,18 Apr 2017,"$20,757,977",Open Road Films,http://sleeplessmovie.com/,True
10,The Big Sick,2017,R,14 Jul 2017,120 min,"Comedy, Drama, Romance",Michael Showalter,"Emily V. Gordon, Kumail Nanjiani","Kumail Nanjiani, Zoe Kazan, Holly Hunter, Ray Romano","Pakistan-born comedian Kumail Nanjiani and grad student Emily Gardner fall in love but struggle as their cultures clash. When Emily contracts a mysterious illness, Kumail finds himself forced to face her feisty parents, his family's expectations, and his true feelings.","English, Urdu",USA,Nominated for 1 Oscar. Another 16 wins & 84 nominations.,https://m.media-amazon.com/images/M/MV5BZWM4YzZjOTEtZmU5ZS00ZTRkLWFiNjAtZTEwNzIzMDM5MjdmXkEyXkFqcGdeQXVyNDg2MjUxNjM@._V1_SX300.jpg,"[{'Source': 'Internet Movie Database', 'Value': '7.6/10'}, {'Source': 'Rotten Tomatoes', 'Value': '98%'}, {'Source': 'Metacritic', 'Value': '86/100'}]",86,7.6,"100,807",tt5462602,movie,19 Sep 2017,"$42,824,653",Amazon Studios,http://www.thebigsickmovie.com/,True
11,Detour,1945,Not Rated,01 Oct 1946,68 min,"Crime, Drama, Film-Noir",Edgar G. Ulmer,"Martin Goldsmith (screenplay), Martin Goldsmith (original story)","Tom Neal, Ann Savage, Claudia Drake, Edmund MacDonald",Chance events trap hitch-hiker Al Roberts in a tightening net of film noir trouble.,English,USA,1 win.,https://m.media-amazon.com/images/M/MV5BYTVhNTU2YzMtOTVjNy00YzhhLTk5OWItMjU4ZGMyNDQ4ZDIwXkEyXkFqcGdeQXVyMDI2NDg0NQ@@._V1_SX300.jpg,"[{'Source': 'Internet Movie Database', 'Value': '7.4/10'}, {'Source': 'Rotten Tomatoes', 'Value': '100%'}]",N/A,7.4,"11,969",tt0037638,movie,26 Sep 2000,N/A,Film Chest,http://filmchestmediagroup.com/,True
12,The Red Turtle,2016,PG,20 Jan 2017,80 min,"Animation, Fantasy",Michael Dudok de Wit,"Michael Dudok de Wit (story), Pascale Ferran (screenplay), Michael Dudok de Wit (screenplay)","Emmanuel Garijo, Tom Hudson, Baptiste Goy, Axel Devillers","A man is shipwrecked on a deserted island and encounters a red turtle, which changes his life.",None,"France, Belgium, Japan, Poland, Netherlands, Hungary, UK, Germany, China, Thailand, Italy, Denmark, USA",Nominated for 1 Oscar. Another 11 wins & 32 nominations.,https://m.media-amazon.com/images/M/MV5BODU3MjIxZWMtODFjYy00ZTI5LThmMzctMTMzZWFlOTIzNTc2L2ltYWdlXkEyXkFqcGdeQXVyNTAyODkwOQ@@._V1_SX300.jpg,"[{'Source': 'Internet Movie Database', 'Value': '7.5/10'}, {'Source': 'Rotten Tomatoes', 'Value': '93%'}, {'Source': 'Metacritic', 'Value': '86/100'}]",86,7.5,"24,030",tt3666024,movie,02 May 2017,"$920,057",Studio Ghibli,http://sonyclassics.com/theredturtle/,True
13,The Resurrection of Gavin Stone,2016,PG,20 Jan 2017,91 min,"Comedy, Drama, Family, Romance",Dallas Jenkins,Andrea Gyertson Nasfell,"Brett Dalton, Anjelah Johnson-Reyes, Neil Flynn, D.B. Sweeney","A washed-up former child star, forced to do community service at a local megachurch, pretends to be a Christian to land the part of Jesus in their annual Passion Play, only to discover that the most important role of his life is far from Hollywood.",English,USA,1 win.,https://m.media-amazon.com/images/M/MV5BMTUxNDY4OTcxMV5BMl5BanBnXkFtZTgwNTIwNzczMDI@._V1_SX300.jpg,"[{'Source': 'Internet Movie Database', 'Value': '6.2/10'}, {'Source': 'Metacritic', 'Value': '36/100'}]",36,6.2,"1,513",tt4902904,movie,N/A,N/A,N/A,N/A,True
14,Split,2016,PG-13,20 Jan 2017,117 min,"Horror, Thriller",M. Night Shyamalan,M. Night Shyamalan,"James McAvoy, Anya Taylor-Joy, Betty Buckley, Haley Lu Richardson",Three girls are kidnapped by a man with a diagnosed 23 distinct personalities. They must try to escape before the apparent emergence of a frightful new 24th.,English,"USA, Japan",8 wins & 19 nominations.,https://m.media-amazon.com/images/M/MV5BZTJiNGM2NjItNDRiYy00ZjY0LTgwNTItZDBmZGRlODQ4YThkL2ltYWdlXkEyXkFqcGdeQXVyMjY5ODI4NDk@._V1_SX300.jpg,"[{'Source': 'Internet Movie Database', 'Value': '7.3/10'}, {'Source': 'Rotten Tomatoes', 'Value': '77%'}, {'Source': 'Metacritic', 'Value': '62/100'}]",62,7.3,"330,957",tt4972582,movie,18 Apr 2017,"$138,120,085",Universal Pictures,http://www.splitmovie.com/,True
15,Trespass Against Us,2016,R,24 Nov 2016,99 min,"Action, Crime, Drama, Thriller",Adam Smith,Alastair Siddons,"Michael Fassbender, Brendan Gleeson, Lyndsey Marshal, Georgie Smith",A man looks to find a way to escape the criminal ways of his outlaw family.,English,UK,5 nominations.,https://m.media-amazon.com/images/M/MV5BMTQ5Njk4OTgzNV5BMl5BanBnXkFtZTgwMDc0OTAxMDI@._V1_SX300.jpg,"[{'Source': 'Internet Movie Database', 'Value': '5.8/10'}, {'Source': 'Rotten Tomatoes', 'Value': '57%'}, {'Source': 'Metacritic', 'Value': '50/100'}]",50,5.8,"6,416",tt3305308,movie,07 Mar 2017,N/A,A24 and DIRECTV,http://a24films.com/films/trespass-against-us/,True
16,xXx: Return of Xander Cage,2017,PG-13,20 Jan 2017,107 min,"Action, Adventure, Thriller",D.J. Caruso,"Rich Wilkes (based on characters created by), F. Scott Frazier","Vin Diesel, Donnie Yen, Deepika Padukone, Kris Wu","Xander Cage is left for dead after an incident, though he secretly returns to action for a new, tough assignment with his handler Augustus Gibbons.","English, Spanish, Portuguese, Mandarin, Tagalog, Russian","China, Canada, USA",1 win & 6 nominations.,https://m.media-amazon.com/images/M/MV5BMzcwMjkxMzQ3NV5BMl5BanBnXkFtZTgwMzgyNDA5MDI@._V1_SX300.jpg,"[{'Source': 'Internet Movie Database', 'Value': '5.2/10'}, {'Source': 'Rotten Tomatoes', 'Value': '47%'}, {'Source': 'Metacritic', 'Value': '42/100'}]",42,5.2,"76,151",tt1293847,movie,16 May 2017,"$44,850,317",Paramount Pictures,http://www.returnofxandercage.com/,True
17,Get Out,2017,R,24 Feb 2017,104 min,"Horror, Mystery, Thriller",Jordan Peele,Jordan Peele,"Daniel Kaluuya, Allison Williams, Catherine Keener, Bradley Whitford","A young African-American visits his white girlfriend's parents for the weekend, where his simmering uneasiness about their reception of him eventually reaches a boiling point.",English,"Japan, USA",Won 1 Oscar. Another 122 wins & 181 nominations.,https://m.media-amazon.com/images/M/MV5BMjUxMDQwNjcyNl5BMl5BanBnXkFtZTgwNzcwMzc0MTI@._V1_SX300.jpg,"[{'Source': 'Internet Movie Database', 'Value': '7.7/10'}, {'Source': 'Rotten Tomatoes', 'Value': '98%'}, {'Source': 'Metacritic', 'Value': '84/100'}]",84,7.7,"367,135",tt5052448,movie,23 May 2017,"$175,428,355",Universal Pictures,http://www.getoutfilm.com/,True
18,Sophie and the Rising Sun,2016,R,22 Jan 2016,105 min,Drama,Maggie Greenwald,"Maggie Greenwald (screenplay), Augusta Trobaugh (novel)","Julianne Nicholson, Takashi Yamaguchi, Margo Martindale, Diane Ladd","Autumn of 1941 in Salty Creek, a fishing village in South Carolina, two interracial lovers are swept up in the tides of history.",English,USA,3 nominations.,https://m.media-amazon.com/images/M/MV5BMjI0NzAxNTQyMl5BMl5BanBnXkFtZTgwODQzMTIwMTI@._V1_SX300.jpg,"[{'Source': 'Internet Movie Database', 'Value': '6.5/10'}, {'Source': 'Rotten Tomatoes', 'Value': '64%'}, {'Source': 'Metacritic', 'Value': '55/100'}]",55,6.5,911,tt4532818,movie,21 Feb 2017,"$30,348",Monterey Media,https://www.montereymedia.com/sophieandtherisingsun/,True
19,A Dog's Purpose,2017,PG,27 Jan 2017,100 min,"Adventure, Comedy, Drama, Family, Fantasy",Lasse Hallström,"W. Bruce Cameron (screenplay by), Cathryn Michon (screenplay by), Audrey Wells (screenplay by), Maya Forbes (screenplay by), Wallace Wolodarsky (screenplay), W. Bruce Cameron (based on the novel by)","Josh Gad, Dennis Quaid, Peggy Lipton, Bryce Gheisar",A dog looks to discover his purpose in life over the course of several lifetimes and owners.,English,"USA, India",3 nominations.,https://m.media-amazon.com/images/M/MV5BNDQ4NjkxNzgzN15BMl5BanBnXkFtZTgwMjAzODQ4OTE@._V1_SX300.jpg,"[{'Source': 'Internet Movie Database', 'Value': '7.0/10'}, {'Source': 'Rotten Tomatoes', 'Value': '35%'}, {'Source': 'Metacritic', 'Value': '43/100'}]",43,7.0,"50,488",tt1753383,movie,02 May 2017,"$64,304,940",Amblin Entertainment,http://www.adogspurposemovie.com/,True
20,I Am Michael,2015,Not Rated,27 Jan 2017,98 min,"Biography, Drama, Romance",Justin Kelly,"Justin Kelly, Stacey Miller (based on an article by), Benoit Denizet Lewis (based on the magazine article ""My Ex-Gay Friend"" by)","James Franco, Zachary Quinto, Emma Roberts, Charlie Carver","Based on the fascinating true-life story of Michael Glatze, a gay activist who becomes a Christian pastor after identifying as a heterosexual.",English,USA,8 wins & 3 nominations.,https://m.media-amazon.com/images/M/MV5BMjAxNjI1NDc1Nl5BMl5BanBnXkFtZTgwMzQ1NTQwMTI@._V1_SX300.jpg,"[{'Source': 'Internet Movie Database', 'Value': '5.7/10'}, {'Source': 'Rotten Tomatoes', 'Value': '64%'}, {'Source': 'Metacritic', 'Value': '56/100'}]",56,5.7,"4,026",tt3713030,movie,07 Mar 2017,N/A,Brainstorm Media,N/A,True
21,iBoy,2017,N/A,27 Jan 2017,90 min,"Action, Crime, Sci-Fi, Thriller",Adam Randall,"Joe Barton (screenplay), Joe Barton, Kevin Brooks (based on the novel by), Mark Denton, Jonny Stockwood","Bill Milner, Maisie Williams, Miranda Richardson, Rory Kinnear","After being shot, Tom wakes from a coma to discover that fragments of his smart phone have been embedded in his head, and worse, that returning to normal teenage life is impossible because he has developed a strange set of superpowers.",English,UK,N/A,https://m.media-amazon.com/images/M/MV5BNjQxODM2MDAyM15BMl5BanBnXkFtZTgwODc4MTE0MTI@._V1_SX300.jpg,"[{'Source': 'Internet Movie Database', 'Value': '6.0/10'}, {'Source': 'Rotten Tomatoes', 'Value': '64%'}, {'Source': 'Metacritic', 'Value': '50/100'}]",50,6.0,"15,769",tt3171832,movie,27 Jan 2017,N/A,Netflix,N/A,True
22,Lost in Florence,2017,NOT RATED,27 Jan 2017,97 min,"Adventure, Drama, Romance",Evan Oppenheimer,"Evan Oppenheimer, Evan Oppenheimer","Brett Dalton, Stana Katic, Alessandra Mastronardi, Alessandro Preziosi",A heartbroken American in Florence gets involved in a dangerous local sport -- and with an alluring local woman.,English,"Italy, USA",N/A,https://m.media-amazon.com/images/M/MV5BY2M1ZjFmYTUtMjdmYS00YTRlLTg4NjctNTg1NmU0ZGYxMTdhL2ltYWdlL2ltYWdlXkEyXkFqcGdeQXVyMjY0NzEzMTk@._V1_SX300.jpg,"[{'Source': 'Internet Movie Database', 'Value': '5.1/10'}, {'Source': 'Rotten Tomatoes', 'Value': '14%'}, {'Source': 'Metacritic', 'Value': '28/100'}]",28,5.1,587,tt3809276,movie,N/A,N/A,Black Sand Pictures,http://www.lostinflorencemovie.com/,True
23,Resident Evil: The Final Chapter,2016,R,27 Jan 2017,107 min,"Action, Horror, Sci-Fi, Thriller",Paul W.S. Anderson,Paul W.S. Anderson,"Milla Jovovich, Iain Glen, Ali Larter, Shawn Roberts","Alice returns to where the nightmare began: The Hive in Raccoon City, where the Umbrella Corporation is gathering its forces for a final strike against the only remaining survivors of the apocalypse.",English,"USA, Germany, France, Canada, South Africa, Australia, UK, Japan",1 win & 3 nominations.,https://m.media-amazon.com/images/M/MV5BMTc0Mzc2OTQ0Ml5BMl5BanBnXkFtZTgwOTQ5MjE4MDI@._V1_SX300.jpg,"[{'Source': 'Internet Movie Database', 'Value': '5.6/10'}, {'Source': 'Rotten Tomatoes', 'Value': '37%'}, {'Source': 'Metacritic', 'Value': '49/100'}]",49,5.6,"72,594",tt2592614,movie,16 May 2017,"$26,844,692",Sony Pictures,http://www.sonypictures.com/movies/residentevilthefinalchapter/,True
24,Wheels,2014,R,01 Feb 2017,115 min,Drama,"Tim Gagliardo(co-director), Donavon Warren(co-director)",Donavon Warren,"Donavon Warren, Patrick Hume, Diana Gettinger, Kevin McCorkle",Two suicidal paraplegic junkies hustle their way through the city streets trying to find a reason to live.,English,USA,N/A,https://m.media-amazon.com/images/M/MV5BYmExM2M4OTctOTlkZi00MTFmLWI3OTctYjVmMDdmZDQ4ODIzXkEyXkFqcGdeQXVyMjYzOTAyMw@@._V1_SX300.jpg,"[{'Source': 'Internet Movie Database', 'Value': '9.3/10'}]",N/A,9.3,"17,233",tt2170667,movie,N/A,N/A,Loaded Dice Films,http://www.wheelsthemovie.com/,True
25,Don't Knock Twice,2016,R,03 Feb 2017,93 min,Horror,Caradog W. James,"Mark Huckerby, Nick Ostler","Katee Sackhoff, Lucy Boynton, Richard Mylan, Nick Moran",A mother desperate to reconnect with her troubled daughter becomes embroiled in the urban legend of a demonic witch.,English,UK,1 nomination.,https://m.media-amazon.com/images/M/MV5BZmFkNzQyNzAtNmUzYi00MWUxLTkxZTAtOGMzMjFkMzMzMTVmXkEyXkFqcGdeQXVyMTg2MzQ2NDk@._V1_SX300.jpg,"[{'Source': 'Internet Movie Database', 'Value': '5.1/10'}, {'Source': 'Rotten Tomatoes', 'Value': '24%'}, {'Source': 'Metacritic', 'Value': '45/100'}]",45,5.1,"10,201",tt3622110,movie,01 Aug 2017,N/A,Red &amp; Black Films,http://dontknocktwice.com/,True
26,Growing Up Smith,2015,PG-13,03 Feb 2017,102 min,"Comedy, Drama, Family",Frank Lotito,"Anjul Nigam, Paul Quinn, Gregory Scott Houghton, Anjul Nigam (screenplay)","Jason Lee, Anjul Nigam, Brighton Sharbino, Hilarie Burton","In 1979, an Indian family moves to America with hopes of living the American Dream. While their 10-year-old boy Smith falls head-over-heels for the girl next door, his desire to become a ""good old boy"" propels him further away from his family's ideals than ever before.",English,USA,5 wins & 8 nominations.,https://m.media-amazon.com/images/M/MV5BOWI0MmZmN2MtMzczMy00Y2NlLWE2MzgtMWM0YTlmY2Y5MTczXkEyXkFqcGdeQXVyMDExMDMxOA@@._V1_SX300.jpg,"[{'Source': 'Internet Movie Database', 'Value': '6.8/10'}, {'Source': 'Rotten Tomatoes', 'Value': '73%'}]",N/A,6.8,821,tt1105355,movie,13 Jun 2017,"$14,867",Good Deed Entertainment,http://www.growingupsmithmovie.com,True
27,I Am Not Your Negro,2016,PG-13,17 Feb 2017,93 min,Documentary,Raoul Peck,"James Baldwin (writings), Raoul Peck (scenario)","Samuel L. Jackson, James Baldwin, Martin Luther King, Malcolm X","Writer James Baldwin tells the story of race in modern America with his unfinished novel, Remember This House.","English, French","Switzerland, France, Belgium, USA",Nominated for 1 Oscar. Another 25 wins & 45 nominations.,https://m.media-amazon.com/images/M/MV5BZWIzYTIxYWYtMzk0MC00ODFlLTljZjItN2MzYmNhMjRlOTRjXkEyXkFqcGdeQXVyMTMxODk2OTU@._V1_SX300.jpg,"[{'Source': 'Internet Movie Database', 'Value': '7.8/10'}, {'Source': 'Rotten Tomatoes', 'Value': '98%'}, {'Source': 'Metacritic', 'Value': '95/100'}]",95,7.8,"13,265",tt5804038,movie,02 May 2017,"$7,120,626",Magnolia Pictures,http://www.iamnotyournegrofilm.com/,True
28,Rings,2017,PG-13,03 Feb 2017,102 min,"Drama, Horror, Romance",F. Javier Gutiérrez,"David Loucka (screenplay by), Jacob Estes (screenplay by), Akiva Goldsman (screenplay by), David Loucka (story by), Jacob Estes (story by), Kôji Suzuki (based on the novel ""The Ring"" by)","Matilda Anna Ingrid Lutz, Alex Roe, Johnny Galecki, Vincent D'Onofrio",A young woman finds herself on the receiving end of a terrifying curse that threatens to take her life in 7 days.,English,USA,2 wins.,https://m.media-amazon.com/images/M/MV5BNjU1NDAxNTg0MF5BMl5BanBnXkFtZTgwNzUxMjEwMTI@._V1_SX300.jpg,"[{'Source': 'Internet Movie Database', 'Value': '4.5/10'}, {'Source': 'Rotten Tomatoes', 'Value': '7%'}, {'Source': 'Metacritic', 'Value': '25/100'}]",25,4.5,"33,125",tt0498381,movie,02 May 2017,"$27,766,716",Paramount Pictures,http://www.ringsmovie.com/,True
29,The Space Between Us,2017,PG-13,03 Feb 2017,120 min,"Adventure, Drama, Romance, Sci-Fi",Peter Chelsom,"Allan Loeb (screenplay by), Stewart Schill (story by), Richard Barton Lewis (story by), Allan Loeb (story by)","Gary Oldman, Janet Montgomery, Trey Tucker, Scott Takeda","The first human born on Mars travels to Earth for the first time, experiencing the wonders of the planet through fresh eyes. He embarks on an adventure with a street smart girl to discover how he came to be.",English,USA,4 nominations.,https://m.media-amazon.com/images/M/MV5BNjYzODU1OTkwN15BMl5BanBnXkFtZTgwMDA3MTMwMDI@._V1_SX300.jpg,"[{'Source': 'Internet Movie Database', 'Value': '6.4/10'}, {'Source': 'Rotten Tomatoes', 'Value': '16%'}, {'Source': 'Metacritic', 'Value': '33/100'}]",33,6.4,"39,599",tt3922818,movie,16 May 2017,"$7,829,766",STX Entertainment,http://stxmovies.com/thespacebetweenus/,True
30,War on Everyone,2016,R,03 Feb 2017,98 min,"Action, Comedy",John Michael McDonagh,John Michael McDonagh,"Alexander Skarsgård, Michael Peña, Theo James, Tessa Thompson","Two corrupt cops set out to blackmail and frame every criminal unfortunate enough to cross their path. Events, however, are complicated by the arrival of someone who appears to be even more dangerous than they are.","English, Spanish",UK,1 win & 1 nomination.,https://m.media-amazon.com/images/M/MV5BNTU2MjAxMjk3Nl5BMl5BanBnXkFtZTgwMjM5NzI5MDI@._V1_SX300.jpg,"[{'Source': 'Internet Movie Database', 'Value': '5.8/10'}, {'Source': 'Rotten Tomatoes', 'Value': '60%'}, {'Source': 'Metacritic', 'Value': '50/100'}]",50,5.8,"15,045",tt3708886,movie,11 Apr 2017,"$187,564",Saban Films,https://www.facebook.com/waroneveryone/,True
31,Youth in Oregon,2016,N/A,03 Feb 2017,105 min,"Comedy, Drama",Joel David Moore,Andrew Eisen,"Frank Langella, Billy Crudup, Christina Applegate, Mary Kay Place","A man is tasked with driving his embittered 80-year-old father-in-law cross country to be legally euthanized in Oregon, while along the way helping him rediscover a reason for living.",English,USA,1 win & 1 nomination.,https://m.media-amazon.com/images/M/MV5BMjQyMjYyNjUzNl5BMl5BanBnXkFtZTgwNjI0ODAxMTI@._V1_SX300.jpg,"[{'Source': 'Internet Movie Database', 'Value': '5.6/10'}, {'Source': 'Rotten Tomatoes', 'Value': '45%'}, {'Source': 'Metacritic', 'Value': '38/100'}]",38,5.6,964,tt3687316,movie,04 Apr 2017,N/A,Samuel Goldwyn Films,http://www.samuelgoldwynfilms.com/youth-in-oregon/,True
32,Fifty Shades Darker,2017,R,10 Feb 2017,118 min,"Drama, Romance",James Foley,"Niall Leonard (screenplay by), E.L. James (based on the novel by)","Dakota Johnson, Jamie Dornan, Eric Johnson, Eloise Mumford","While Christian wrestles with his inner demons, Anastasia must confront the anger and envy of the women who came before her.",English,"USA, China",3 wins & 12 nominations.,https://m.media-amazon.com/images/M/MV5BMTQ5NTk0Njg2N15BMl5BanBnXkFtZTgwNzk5Nzk3MDI@._V1_SX300.jpg,"[{'Source': 'Internet Movie Database', 'Value': '4.6/10'}, {'Source': 'Rotten Tomatoes', 'Value': '12%'}, {'Source': 'Metacritic', 'Value': '33/100'}]",33,4.6,"78,867",tt4465564,movie,09 May 2017,"$114,376,885",Universal Pictures,http://www.cinquentatonsfilmes.com.br/,True
