,Title,Year,Rated,Released,Runtime,Genre,Director,Writer,Actors,Plot,Language,Country,Awards,Poster,Ratings,Metascore,imdbRating,imdbVotes,imdbID,Type,DVD,BoxOffice,Production,Website,Response
198,American Assassin,2017,R,15 Sep 2017,112 min,"Action, Thriller",Michael Cuesta,"Stephen Schiff (screenplay by), Michael Finch (screenplay by), Edward Zwick (screenplay by), Marshall Herskovitz (screenplay by), Vince Flynn (based on the novel by)","Dylan O'Brien, Charlotte Vega, Christopher Bomford, Chris Webster","After the death of his girlfriend at the hands of terrorists, Mitch Rapp is drawn into the world of counterterrorism, mentored by tough-as-nails former U.S. Navy S.E.A.L. Stan Hurley.","English, Spanish, Arabic, Polish, Turkish, Russian, Italian, Persian",USA,1 nomination.,https://m.media-amazon.com/images/M/MV5BMjM0MjY4MTk5NV5BMl5BanBnXkFtZTgwNDE2NTQyMzI@._V1_SX300.jpg,"[{'Source': 'Internet Movie Database', 'Value': '6.2/10'}, {'Source': 'Rotten Tomatoes', 'Value': '35%'}, {'Source': 'Metacritic', 'Value': '45/100'}]",45,6.2,"55,683",tt1961175,movie,05 Dec 2017,"$34,449,582",Lionsgate and CBS Films,http://www.cbsfilms.com/american-assassin/,True
199,Brad's Status,2017,R,15 Sep 2017,102 min,"Comedy, Drama, Music",Mike White,Mike White,"Ben Stiller, Austin Abrams, Jenna Fischer, Michael Sheen",A father takes his son to tour colleges on the East Coast and meets up with an old friend who makes him feel inferior about his life's choices.,English,USA,1 win & 2 nominations.,https://m.media-amazon.com/images/M/MV5BNDliZTUwZTktYmJlNC00MGE1LWEwODktNWZiNTRkMGFiNTg1XkEyXkFqcGdeQXVyNjU5NzU3MjE@._V1_SX300.jpg,"[{'Source': 'Internet Movie Database', 'Value': '6.5/10'}, {'Source': 'Rotten Tomatoes', 'Value': '80%'}, {'Source': 'Metacritic', 'Value': '71/100'}]",71,6.5,"12,624",tt5884230,movie,02 Jan 2018,"$2,029,594",Amazon Studios,http://bradsstatus.movie/,True
200,Mother!,2017,R,15 Sep 2017,121 min,"Drama, Horror, Mystery",Darren Aronofsky,Darren Aronofsky,"Jennifer Lawrence, Javier Bardem, Ed Harris, Michelle Pfeiffer","A couple's relationship is tested when uninvited guests arrive at their home, disrupting their tranquil existence.",English,USA,5 wins & 30 nominations.,https://m.media-amazon.com/images/M/MV5BMzc5ODExODE0MV5BMl5BanBnXkFtZTgwNDkzNDUxMzI@._V1_SX300.jpg,"[{'Source': 'Internet Movie Database', 'Value': '6.6/10'}, {'Source': 'Rotten Tomatoes', 'Value': '69%'}, {'Source': 'Metacritic', 'Value': '75/100'}]",75,6.6,"146,913",tt5109784,movie,19 Dec 2017,"$17,297,289",Paramount Pictures,http://www.mothermovie.com,True
201,The Lego Ninjago Movie,2017,PG,22 Sep 2017,101 min,"Animation, Action, Adventure, Comedy, Family","Charlie Bean, Paul Fisher, Bob Logan","Bob Logan (screenplay by), Paul Fisher (screenplay by), William Wheeler (screenplay by), Tom Wheeler (screenplay by), Jared Stern (screenplay by), John Whittington (screenplay by), Hilary Winston (story by), Bob Logan (story by), Paul Fisher (story by), William Wheeler (story by), Tom Wheeler (story by), Dan Hageman (story by), Kevin Hageman (story by)","Jackie Chan, Dave Franco, Fred Armisen, Kumail Nanjiani","Shunned by everyone for being the son of an evil warlord, a teenager seeks to defeat him with the help of his fellow ninjas.",English,"USA, Denmark, Australia",4 nominations.,https://m.media-amazon.com/images/M/MV5BNDI3MDljMTQtYzBiYS00NDk2LTlhYzUtYmM0NWIyMmZkMDZkXkEyXkFqcGdeQXVyNjk5NDA3OTk@._V1_SX300.jpg,"[{'Source': 'Internet Movie Database', 'Value': '6.0/10'}, {'Source': 'Rotten Tomatoes', 'Value': '56%'}, {'Source': 'Metacritic', 'Value': '55/100'}]",55,6.0,"17,528",tt3014284,movie,19 Dec 2017,"$58,938,889",Warner Bros. Pictures,https://www.lego.com/en-us/ninjago,True
202,Kingsman: The Golden Circle,2017,R,22 Sep 2017,141 min,"Action, Adventure, Comedy",Matthew Vaughn,"Jane Goldman, Matthew Vaughn, Mark Millar (based on the comic book ""The Secret Service"" by), Dave Gibbons (based on the comic book ""The Secret Service"" by)","Taron Egerton, Edward Holcroft, Gordon Alexander, Mark Strong","When their headquarters are destroyed and the world is held hostage, the Kingsman's journey leads them to the discovery of an allied spy organization in the United States. These two elite secret organizations must band together to defeat a common enemy.","English, Italian, Swedish","UK, USA",1 win & 4 nominations.,https://m.media-amazon.com/images/M/MV5BMjQ3OTgzMzY4NF5BMl5BanBnXkFtZTgwOTc4OTQyMzI@._V1_SX300.jpg,"[{'Source': 'Internet Movie Database', 'Value': '6.8/10'}, {'Source': 'Rotten Tomatoes', 'Value': '53%'}, {'Source': 'Metacritic', 'Value': '44/100'}]",44,6.8,"219,817",tt4649466,movie,12 Dec 2017,"$99,733,121",20th Century Fox,http://www.foxmovies.com/movies/kingsman-the-golden-circle,True
203,Goodbye Christopher Robin,2017,PG,29 Sep 2017,107 min,"Biography, Drama",Simon Curtis,"Frank Cottrell Boyce, Simon Vaughan","Vicki Pepperdine, Margot Robbie, Domhnall Gleeson, Will Tilston","The relationship between writer AA Milne and his son, Christopher Robin, and how this became the inspiration for Winnie the Pooh.",English,UK,2 wins & 1 nomination.,https://m.media-amazon.com/images/M/MV5BMjE2MTUzMDQzNF5BMl5BanBnXkFtZTgwMDYxMDQ1MjI@._V1_SX300.jpg,"[{'Source': 'Internet Movie Database', 'Value': '7.1/10'}, {'Source': 'Rotten Tomatoes', 'Value': '63%'}, {'Source': 'Metacritic', 'Value': '54/100'}]",54,7.1,"18,958",tt1653665,movie,23 Jan 2018,"$1,659,463",Fox Searchlight Pictures,https://www.facebook.com/goodbyechristopherrobin/,True
204,Marshall,2017,PG-13,13 Oct 2017,118 min,"Biography, Crime, Drama, History",Reginald Hudlin,"Michael Koskoff, Jacob Koskoff","Chadwick Boseman, Josh Gad, Kate Hudson, Sterling K. Brown","The story of Thurgood Marshall, the crusading lawyer who would become the first African-American Supreme Court Justice, as he battles through one of his career-defining cases.",English,"USA, China",Nominated for 1 Oscar. Another 4 wins & 16 nominations.,https://m.media-amazon.com/images/M/MV5BNzg3YTc4N2ItZmZkZS00OWE1LWIyNGMtNzYzZWQzMzVkZWI2XkEyXkFqcGdeQXVyNTQ3MjE4NTU@._V1_SX300.jpg,"[{'Source': 'Internet Movie Database', 'Value': '7.2/10'}, {'Source': 'Metacritic', 'Value': '66/100'}]",66,7.2,"13,628",tt5301662,movie,N/A,N/A,N/A,N/A,True
205,Loving Vincent,2017,PG-13,22 Sep 2017,94 min,"Animation, Biography, Crime, Drama, Mystery","Dorota Kobiela, Hugh Welchman","Dorota Kobiela, Hugh Welchman, Jacek Dehnel","Douglas Booth, Josh Burdett, Holly Earl, Robin Hodges","In a story depicted in oil painted animation, a young man comes to the last hometown of painter Vincent van Gogh to deliver the troubled artist's final letter and ends up investigating his final days there.",English,"Poland, UK, USA",Nominated for 1 Oscar. Another 17 wins & 48 nominations.,https://m.media-amazon.com/images/M/MV5BMTU3NjE2NjgwN15BMl5BanBnXkFtZTgwNDYzMzEwMzI@._V1_SX300.jpg,"[{'Source': 'Internet Movie Database', 'Value': '7.8/10'}, {'Source': 'Rotten Tomatoes', 'Value': '85%'}, {'Source': 'Metacritic', 'Value': '62/100'}]",62,7.8,"37,229",tt3262342,movie,16 Jan 2018,"$6,388,510",Good Deed Entertainment,http://lovingvincent.com/,True
206,Stronger,2017,R,29 Sep 2017,119 min,"Biography, Drama",David Gordon Green,"John Pollono (screenplay by), Jeff Bauman (based on the book ""Stronger"" by), Bret Witter (based on the book ""Stronger"" by)","Jake Gyllenhaal, Tatiana Maslany, Miranda Richardson, Richard Lane Jr.","Stronger is the inspiring real life story of Jeff Bauman, an ordinary man who captured the hearts of his city and the world to become a symbol of hope after surviving the 2013 Boston Marathon bombing.",English,USA,2 wins & 8 nominations.,https://m.media-amazon.com/images/M/MV5BMjE0NjIwMjQ2MF5BMl5BanBnXkFtZTgwNTAxMzQ5MjI@._V1_SX300.jpg,"[{'Source': 'Internet Movie Database', 'Value': '7.0/10'}, {'Source': 'Rotten Tomatoes', 'Value': '90%'}, {'Source': 'Metacritic', 'Value': '76/100'}]",76,7.0,"31,654",tt3881784,movie,19 Dec 2017,"$4,192,426",Lionsgate and Roadside Attractions,http://strongerthefilm.com/home/,True
207,Victoria & Abdul,2017,PG-13,06 Oct 2017,111 min,"Biography, Drama, History",Stephen Frears,"Lee Hall (screenplay by), Shrabani Basu (based on the book by)","Judi Dench, Ali Fazal, Tim Pigott-Smith, Eddie Izzard",Queen Victoria strikes up an unlikely friendship with a young Indian clerk named Abdul Karim.,"English, Urdu, Hindi","UK, USA",Nominated for 2 Oscars. Another 3 wins & 10 nominations.,https://m.media-amazon.com/images/M/MV5BMjA4NzY1NTQ1Nl5BMl5BanBnXkFtZTgwMTM3NTY0MjI@._V1_SX300.jpg,"[{'Source': 'Internet Movie Database', 'Value': '6.8/10'}, {'Source': 'Rotten Tomatoes', 'Value': '65%'}, {'Source': 'Metacritic', 'Value': '58/100'}]",58,6.8,"24,065",tt5816682,movie,19 Dec 2017,"$21,667,320",Focus Features,http://focusfeatures.com/victoriaandabdul,True
208,Woodshock,2017,R,22 Sep 2017,100 min,"Drama, Thriller","Kate Mulleavy, Laura Mulleavy","Kate Mulleavy, Laura Mulleavy","Kirsten Dunst, Joe Cole, Pilou Asbæk, Steph DuVall","A haunted young woman spirals in the wake of profound loss, torn between her fractured emotional state and the reality-altering effects of a potent cannabinoid drug.",English,USA,N/A,https://m.media-amazon.com/images/M/MV5BMTYzNTU0MzQ0Ml5BMl5BanBnXkFtZTgwNjA0NTc5MjI@._V1_SX300.jpg,"[{'Source': 'Internet Movie Database', 'Value': '4.3/10'}, {'Source': 'Rotten Tomatoes', 'Value': '24%'}, {'Source': 'Metacritic', 'Value': '39/100'}]",39,4.3,"1,166",tt4677924,movie,28 Nov 2017,"$41,126",A24 Films,http://woodshockmovie.com/,True
209,My Little Pony: The Movie,2017,PG,06 Oct 2017,99 min,"Animation, Action, Adventure, Comedy, Drama, Family, Fantasy, Musical, Sci-Fi, Thriller",Jayson Thiessen,"Meghan McCarthy (story by), Joe Ballarini (story by), Meghan McCarthy (screenplay by), Rita Hsiao (screenplay by), Michael Vogel (screenplay by), Lauren Faust (based on the television series created by)","Uzo Aduba, Ashleigh Ball, Adam Bengis, Emily Blunt","After a dark force conquers Canterlot, the Mane 6 embark on an unforgettable journey beyond Equestria where they meet new friends and exciting challenges on a quest to use the magic of friendship to save their homeland.",English,"USA, Canada",N/A,https://m.media-amazon.com/images/M/MV5BMmMxNWNhNjItZjhmMC00ZmViLThlYjItZDk5YTQ1MWZkOGM1XkEyXkFqcGdeQXVyNzY2ODYzOTU@._V1_SX300.jpg,"[{'Source': 'Internet Movie Database', 'Value': '6.1/10'}, {'Source': 'Rotten Tomatoes', 'Value': '48%'}, {'Source': 'Metacritic', 'Value': '39/100'}]",39,6.1,"4,998",tt4131800,movie,09 Jan 2018,"$21,732,671",Lionsgate,N/A,True
210,N/A,N/A,N/A,N/A,N/A,N/A,N/A,N/A,N/A,N/A,N/A,N/A,N/A,N/A,N/A,N/A,N/A,N/A,N/A,N/A,N/A,N/A,N/A,N/A,False
211,American Made,2017,R,29 Sep 2017,115 min,"Action, Biography, Comedy, Crime, Thriller",Doug Liman,Gary Spinelli,"Tom Cruise, Domhnall Gleeson, Sarah Wright, Jesse Plemons","The story of Barry Seal, an American pilot who became a drug-runner for the CIA in the 1980s in a clandestine operation that would be exposed as the Iran-Contra Affair.","English, Spanish","USA, Japan, Colombia",3 nominations.,https://m.media-amazon.com/images/M/MV5BMTUxNzUwMjk1Nl5BMl5BanBnXkFtZTgwNDkwODI1MjI@._V1_SX300.jpg,"[{'Source': 'Internet Movie Database', 'Value': '7.2/10'}, {'Source': 'Rotten Tomatoes', 'Value': '86%'}, {'Source': 'Metacritic', 'Value': '65/100'}]",65,7.2,"124,743",tt3532216,movie,02 Jan 2018,"$51,071,805",Universal Pictures,http://www.americanmademovie.net/,True
212,Flatliners,1990,R,10 Aug 1990,115 min,"Drama, Horror, Sci-Fi, Thriller",Joel Schumacher,Peter Filardi,"Kiefer Sutherland, Julia Roberts, Kevin Bacon, William Baldwin","Five medical students experiment with ""near death"" experiences, until the dark consequences of past tragedies begin to jeopardize their lives.",English,USA,Nominated for 1 Oscar. Another 2 nominations.,https://m.media-amazon.com/images/M/MV5BMTc3MDE3NTM3Ml5BMl5BanBnXkFtZTgwNzgwNTg4NjE@._V1_SX300.jpg,"[{'Source': 'Internet Movie Database', 'Value': '6.6/10'}, {'Source': 'Rotten Tomatoes', 'Value': '48%'}, {'Source': 'Metacritic', 'Value': '55/100'}]",55,6.6,"74,082",tt0099582,movie,20 Jan 1998,N/A,Sony Pictures Home Entertainment,N/A,True
213,Mark Felt: The Man Who Brought Down the White House,2017,PG-13,29 Sep 2017,103 min,"Biography, Drama, History, Thriller",Peter Landesman,"Mark Felt (based on the books by), John D. O'Connor (based on the books by), Peter Landesman","Liam Neeson, Diane Lane, Marton Csokas, Tony Goldwyn","The story of Mark Felt, who under the name ""Deep Throat"" helped journalists Bob Woodward and Carl Bernstein uncover the Watergate scandal in 1972.",English,USA,1 nomination.,https://m.media-amazon.com/images/M/MV5BMjQzMDEwMjMyNF5BMl5BanBnXkFtZTgwNjA1NTA1MzI@._V1_SX300.jpg,"[{'Source': 'Internet Movie Database', 'Value': '6.4/10'}, {'Source': 'Metacritic', 'Value': '49/100'}]",49,6.4,"8,668",tt5175450,movie,N/A,N/A,N/A,N/A,True
214,Blade Runner 2049,2017,R,06 Oct 2017,164 min,"Drama, Mystery, Sci-Fi, Thriller",Denis Villeneuve,"Hampton Fancher (screenplay by), Michael Green (screenplay by), Hampton Fancher (story by), Philip K. Dick (based on characters from the novel ""Do Androids Dream of Electric Sheep?"" by)","Ryan Gosling, Dave Bautista, Robin Wright, Mark Arnold","A young blade runner's discovery of a long-buried secret leads him to track down former blade runner Rick Deckard, who's been missing for thirty years.","English, Finnish, Japanese, Hungarian, Russian, Somali, Spanish","USA, UK, Hungary, Canada",Won 2 Oscars. Another 81 wins & 131 nominations.,https://m.media-amazon.com/images/M/MV5BNzA1Njg4NzYxOV5BMl5BanBnXkFtZTgwODk5NjU3MzI@._V1_SX300.jpg,"[{'Source': 'Internet Movie Database', 'Value': '8.0/10'}, {'Source': 'Rotten Tomatoes', 'Value': '87%'}, {'Source': 'Metacritic', 'Value': '81/100'}]",81,8.0,"361,393",tt1856101,movie,16 Jan 2018,"$91,800,042",Warner Bros. Pictures,http://bladerunnermovie.com,True
215,Brawl in Cell Block 99,2017,Not Rated,06 Oct 2017,132 min,"Crime, Drama",S. Craig Zahler,S. Craig Zahler,"Vince Vaughn, Jennifer Carpenter, Don Johnson, Udo Kier",A former boxer-turned-drug runner lands in a prison battleground after a deal gets deadly.,English,USA,4 nominations.,https://m.media-amazon.com/images/M/MV5BMzQ4MjEyNjg4Nl5BMl5BanBnXkFtZTgwOTY1NDEzMzI@._V1_SX300.jpg,"[{'Source': 'Internet Movie Database', 'Value': '7.1/10'}, {'Source': 'Rotten Tomatoes', 'Value': '91%'}, {'Source': 'Metacritic', 'Value': '79/100'}]",79,7.1,"40,969",tt5657856,movie,26 Dec 2017,N/A,RLJE Films,N/A,True
216,The Florida Project,2017,R,10 Nov 2017,111 min,Drama,Sean Baker,"Sean Baker, Chris Bergoch","Brooklynn Prince, Christopher Rivera, Aiden Malik, Josie Olivo","Set over one summer, the film follows precocious six-year-old Moonee as she courts mischief and adventure with her ragtag playmates and bonds with her rebellious but caring mother, all while living in the shadows of Walt Disney World.","English, Spanish, Portuguese",USA,Nominated for 1 Oscar. Another 58 wins & 106 nominations.,https://m.media-amazon.com/images/M/MV5BMjg4ZmY1MmItMjFjOS00ZTg2LWJjNDYtNDM2YmM2NzhiNmZhXkEyXkFqcGdeQXVyNTAzMTY4MDA@._V1_SX300.jpg,"[{'Source': 'Internet Movie Database', 'Value': '7.6/10'}, {'Source': 'Rotten Tomatoes', 'Value': '96%'}, {'Source': 'Metacritic', 'Value': '92/100'}]",92,7.6,"67,905",tt5649144,movie,20 Feb 2018,"$5,412,775",June Pictures,N/A,True
217,The Mountain Between Us,2017,PG-13,06 Oct 2017,112 min,"Action, Adventure, Drama, Romance, Thriller",Hany Abu-Assad,"Chris Weitz (screenplay by), J. Mills Goodloe (screenplay by), Charles Martin (based upon the book by)","Idris Elba, Kate Winslet, Beau Bridges, Dermot Mulroney","Stranded after a tragic plane crash, two strangers must forge a connection to survive the extreme elements of a remote snow-covered mountain. When they realize help is not coming, they embark on a perilous journey across the wilderness.",English,USA,2 wins & 1 nomination.,https://m.media-amazon.com/images/M/MV5BNjllMWJmZTEtODA2Mi00MzY3LThiYmMtZDFjYjQ2NDM2MWJkXkEyXkFqcGdeQXVyMTMxODk2OTU@._V1_SX300.jpg,"[{'Source': 'Internet Movie Database', 'Value': '6.4/10'}, {'Source': 'Rotten Tomatoes', 'Value': '39%'}, {'Source': 'Metacritic', 'Value': '48/100'}]",48,6.4,"54,850",tt2226597,movie,26 Dec 2017,"$29,669,726",20th Century Fox,http://MountainBetweenUs.com,True
218,Outrage Coda,2017,N/A,07 Oct 2017,104 min,"Action, Crime, Drama",Takeshi Kitano,Takeshi Kitano (screenplay),"Takeshi Kitano, Toshiyuki Nishida, Tatsuo Nadaka, Ken Mitsuishi","Five years after surviving the all-out war between the Sanno and Hanabishi crime families, former yakuza boss Otomo now works in South Korea for Mr. Chang, a renowned fixer whose influence extends into Japan. A relatively minor incident causes tensions to rise between Chang Enterprises and the faraway powerful Hanabishi. The growing conflict gets out of hand and ignites a ferocious power struggle...","Japanese, Korean",Japan,N/A,https://m.media-amazon.com/images/M/MV5BMmQyMDhhNjMtMjQyMS00OTE2LTg2ZTktMzA2M2ZiZmZkZDZhXkEyXkFqcGdeQXVyNzg0OTg0OTI@._V1_SX300.jpg,"[{'Source': 'Internet Movie Database', 'Value': '6.0/10'}, {'Source': 'Rotten Tomatoes', 'Value': '60%'}, {'Source': 'Metacritic', 'Value': '58/100'}]",58,6.0,"1,296",tt6293042,movie,N/A,N/A,Office Kitano,http://outrage-movie.jp/,True
219,Blood Money,2017,R,13 Oct 2017,100 min,"Crime, Drama, Thriller",Lucky McKee,"Jared Butler, Lars Norberg","Ellar Coltrane, Willa Fitzgerald, Jacob Artist, John Cusack","Three friends on a wilderness excursion must outrun a white collar criminal hellbent on retrieving his cash, but soon their greed turns them against each other. A modern re-telling of ...",English,USA,N/A,https://m.media-amazon.com/images/M/MV5BNThiMWI0YWMtNWJhYy00ZDc5LTk5OWYtNTgwMTM2NTQ0M2EzXkEyXkFqcGdeQXVyNjQzODc2MDg@._V1_SX300.jpg,"[{'Source': 'Internet Movie Database', 'Value': '4.5/10'}, {'Source': 'Rotten Tomatoes', 'Value': '50%'}, {'Source': 'Metacritic', 'Value': '42/100'}]",42,4.5,"1,545",tt3758852,movie,19 Dec 2017,N/A,"Saban Films, Lionsgate",N/A,True
220,Breathe,2017,PG-13,27 Oct 2017,118 min,"Biography, Drama, Romance",Andy Serkis,William Nicholson (screenplay),"Andrew Garfield, Claire Foy, Ed Speleers, Tom Hollander","The inspiring true love story of Robin and Diana Cavendish, an adventurous couple who refuse to give up in the face of a devastating disease. Their heartwarming celebration of human possibility marks the directorial debut of Andy Serkis.","English, German, Spanish",UK,1 win & 3 nominations.,https://m.media-amazon.com/images/M/MV5BMTg1OTcxNjU1MV5BMl5BanBnXkFtZTgwMzcwMTQ3MzI@._V1_SX300.jpg,"[{'Source': 'Internet Movie Database', 'Value': '7.1/10'}, {'Source': 'Rotten Tomatoes', 'Value': '67%'}, {'Source': 'Metacritic', 'Value': '51/100'}]",51,7.1,"14,257",tt5716464,movie,02 Jan 2018,"$475,685",Bleecker Street / Participant Media.,N/A,True
221,The Foreigner,2017,R,13 Oct 2017,113 min,"Action, Crime, Drama, Mystery, Thriller",Martin Campbell,"David Marconi (screenplay by), Stephen Leather (based on the novel ""The Chinaman"" by)","Katie Leung, Jackie Chan, Rufus Jones, Mark Tandy","A humble businessman with a buried past seeks justice when his daughter is killed in an act of terrorism. A cat-and-mouse conflict ensues with a government official, whose past may hold clues to the killers' identities.","English, Mandarin","UK, China, USA",N/A,https://m.media-amazon.com/images/M/MV5BM2RlMjcyMGQtZTU3OC00NGRlLWExMGEtYjU3ZjUyMDc0NWZmXkEyXkFqcGdeQXVyNTI4MzE4MDU@._V1_SX300.jpg,"[{'Source': 'Internet Movie Database', 'Value': '7.0/10'}, {'Source': 'Rotten Tomatoes', 'Value': '64%'}, {'Source': 'Metacritic', 'Value': '55/100'}]",55,7.0,"77,954",tt1615160,movie,09 Jan 2018,"$33,964,179",STX Films,http://TheForeignerMovie.com,True
222,Happy Death Day,2017,PG-13,13 Oct 2017,96 min,"Horror, Mystery, Thriller",Christopher Landon,Scott Lobdell,"Jessica Rothe, Israel Broussard, Ruby Modine, Charles Aitken","A college student must relive the day of her murder over and over again, in a loop that will end only when she discovers her killer's identity.",English,USA,1 nomination.,https://m.media-amazon.com/images/M/MV5BYzZhY2E5NzQtMWVmNC00YmEzLTgxZDMtNjE2YmQ4ZTZiZGZjXkEyXkFqcGdeQXVyODQxMTI4MjM@._V1_SX300.jpg,"[{'Source': 'Internet Movie Database', 'Value': '6.5/10'}, {'Source': 'Rotten Tomatoes', 'Value': '72%'}, {'Source': 'Metacritic', 'Value': '57/100'}]",57,6.5,"74,874",tt5308322,movie,16 Jan 2018,"$55,398,005",Universal Studios,http://www.happydeathdaymovie.com/,True
223,Professor Marston and the Wonder Women,2017,R,13 Oct 2017,108 min,"Biography, Drama",Angela Robinson,Angela Robinson,"Luke Evans, Rebecca Hall, Bella Heathcote, Connie Britton","The story of psychologist William Moulton Marston, and his polyamorous relationship with his wife and their mistress who would inspire his creation of the superheroine, Wonder Woman.",English,USA,6 nominations.,https://m.media-amazon.com/images/M/MV5BMTcyMTQzMDIwNl5BMl5BanBnXkFtZTgwMTY1NjgzMzI@._V1_SX300.jpg,"[{'Source': 'Internet Movie Database', 'Value': '7.1/10'}, {'Source': 'Rotten Tomatoes', 'Value': '86%'}, {'Source': 'Metacritic', 'Value': '68/100'}]",68,7.1,"16,682",tt6133130,movie,30 Jan 2018,"$1,583,641",Annapurna Pictures,http://www.marston.movie/,True
224,Thor: Ragnarok,2017,PG-13,03 Nov 2017,130 min,"Action, Adventure, Comedy, Fantasy, Sci-Fi",Taika Waititi,"Eric Pearson, Craig Kyle, Christopher L. Yost, Stan Lee (based on the Marvel comics by), Larry Lieber (based on the Marvel comics by), Jack Kirby (based on the Marvel comics by)","Chris Hemsworth, Tom Hiddleston, Cate Blanchett, Idris Elba","Thor is imprisoned on the planet Sakaar, and must race against time to return to Asgard and stop Ragnarök, the destruction of his world, at the hands of the powerful and ruthless villain Hela.",English,"USA, Australia",5 wins & 30 nominations.,https://m.media-amazon.com/images/M/MV5BMjMyNDkzMzI1OF5BMl5BanBnXkFtZTgwODcxODg5MjI@._V1_SX300.jpg,"[{'Source': 'Internet Movie Database', 'Value': '7.9/10'}, {'Source': 'Rotten Tomatoes', 'Value': '92%'}, {'Source': 'Metacritic', 'Value': '74/100'}]",74,7.9,"429,908",tt3501632,movie,06 Mar 2018,"$314,971,245",Walt Disney Pictures,http://movies.disney.com/thor-ragnarok,True
225,Wonder Wheel,2017,PG-13,15 Dec 2017,101 min,Drama,Woody Allen,Woody Allen,"Justin Timberlake, Juno Temple, Robert C. Kirk, Kate Winslet","On Coney Island in the 1950s, a lifeguard tells the story of a middle-aged carousel operator, his beleaguered wife, and the visitor who turns their lives upside-down.",English,USA,3 wins & 4 nominations.,https://m.media-amazon.com/images/M/MV5BMTA2NjAyMDIzMzleQTJeQWpwZ15BbWU4MDg1NTEwNjMy._V1_SX300.jpg,"[{'Source': 'Internet Movie Database', 'Value': '6.2/10'}, {'Source': 'Rotten Tomatoes', 'Value': '30%'}, {'Source': 'Metacritic', 'Value': '45/100'}]",45,6.2,"18,732",tt5825380,movie,06 Mar 2018,N/A,Amazon Studios,http://www.wonderwheelmovie.com/,True
226,Boo 2! A Madea Halloween,2017,PG-13,20 Oct 2017,101 min,"Comedy, Horror",Tyler Perry,Tyler Perry,"Tyler Perry, Cassi Davis, Patrice Lovely, Yousef Erakat","Madea, Bam, and Hattie venture to a haunted campground and the group must run for their lives when monsters, goblins, and the boogeyman are unleashed.",English,USA,1 win & 2 nominations.,https://m.media-amazon.com/images/M/MV5BOTgxNzk4ODA3Nl5BMl5BanBnXkFtZTgwOTkyOTg1MzI@._V1_SX300.jpg,"[{'Source': 'Internet Movie Database', 'Value': '3.8/10'}, {'Source': 'Rotten Tomatoes', 'Value': '5%'}, {'Source': 'Metacritic', 'Value': '17/100'}]",17,3.8,"3,182",tt6217804,movie,30 Jan 2018,"$46,649,659",Lionsgate,http://www.Boo.movie,True
227,Coco,2017,PG,22 Nov 2017,105 min,"Animation, Adventure, Comedy, Family, Fantasy, Music, Mystery","Lee Unkrich, Adrian Molina(co-director)","Lee Unkrich (original story by), Jason Katz (original story by), Matthew Aldrich (original story by), Adrian Molina (original story by), Adrian Molina (screenplay by), Matthew Aldrich (screenplay by)","Anthony Gonzalez, Gael García Bernal, Benjamin Bratt, Alanna Ubach","Aspiring musician Miguel, confronted with his family's ancestral ban on music, enters the Land of the Dead to find his great-great-grandfather, a legendary singer.","English, Spanish",USA,Won 2 Oscars. Another 86 wins & 28 nominations.,https://m.media-amazon.com/images/M/MV5BYjQ5NjM0Y2YtNjZkNC00ZDhkLWJjMWItN2QyNzFkMDE3ZjAxXkEyXkFqcGdeQXVyODIxMzk5NjA@._V1_SX300.jpg,"[{'Source': 'Internet Movie Database', 'Value': '8.4/10'}, {'Source': 'Rotten Tomatoes', 'Value': '97%'}, {'Source': 'Metacritic', 'Value': '81/100'}]",81,8.4,"257,917",tt2380307,movie,27 Feb 2018,"$208,487,719",Disney/Pixar,http://movies.disney.com/coco,True
228,Geostorm,2017,PG-13,20 Oct 2017,109 min,"Action, Sci-Fi, Thriller",Dean Devlin,"Dean Devlin, Paul Guyot","Gerard Butler, Jim Sturgess, Abbie Cornish, Alexandra Maria Lara","When the network of satellites designed to control the global climate starts to attack Earth, it's a race against the clock for its creator to uncover the real threat before a worldwide Geostorm wipes out everything and everyone.","English, Cantonese, Russian, Hindi, Spanish",USA,N/A,https://m.media-amazon.com/images/M/MV5BMTA0OTQwMTIxNzheQTJeQWpwZ15BbWU4MDQ1MzI3OTMy._V1_SX300.jpg,"[{'Source': 'Internet Movie Database', 'Value': '5.3/10'}, {'Source': 'Rotten Tomatoes', 'Value': '15%'}, {'Source': 'Metacritic', 'Value': '21/100'}]",21,5.3,"74,879",tt1981128,movie,23 Jan 2018,"$33,681,965",Warner Bros. Pictures,http://www.geostorm.movie/,True
